{
  "actor": {
    "id": "runner:qa",
    "kind": "agent"
  },
  "bindings": {
    "artifacts": [
      {
        "role": "log",
        "sha256": "sha256:4eee36bfdf3e9f570e1d5e51d07a079634aa2db87bcdf5248589ba5fa5195373"
      }
    ],
    "content": [
      {
        "path": "works/ST-001/qa.md",
        "sha256": "sha256:06e7766f4b800ebd7426fd4fca2a5ff696aeb31a8cebd456381d4c70d08f6608"
      }
    ],
    "source": {
      "commit": "e09a35f25d6f7179cb467609eb321afcb8030f85",
      "kind": "git_commit",
      "repository_id": "repo_01M1RWXYDW6Q0WT9J0NMA466BH"
    },
    "work": []
  },
  "id": "rcpt_01M1TQK18NY5JGP8DVBEDM20KT",
  "kind": "qa_checkpoint",
  "payload": {
    "baseline_content_hash": "sha256:06e7766f4b800ebd7426fd4fca2a5ff696aeb31a8cebd456381d4c70d08f6608",
    "cases": [
      {
        "case_hash": "sha256:148d32a3d2b9c2249bfad3503ebb1d3d90707b1a77802c4391086cd52b98f6ea",
        "case_id": "QA-001",
        "outcome": "passed"
      },
      {
        "case_hash": "sha256:4c42ca0af9beb11ad62497eaf34b21e6b7073db1e71d35e6013c31a880c96849",
        "case_id": "QA-002",
        "outcome": "passed"
      }
    ],
    "executor": {
      "capabilities": [
        "runner"
      ],
      "name": "pulse",
      "version": "0.1.0"
    },
    "findings": [],
    "observations": [
      "QA-001: completeTodo returned Completed and marked the todo done without mutating the input",
      "QA-002: completeTodo returned NotFound and left the list unchanged"
    ],
    "payload_version": 1,
    "qa_scope": "story_close",
    "story_id": "ST-001",
    "ticket_id": "TK-001"
  },
  "receipt_version": 2,
  "recorded_at": "2026-09-06T06:48:13.333740Z",
  "result": "passed",
  "schema_version": 1,
  "subject": {
    "id": "ST-001",
    "kind": "work"
  }
}
