{
  "actor": {
    "id": "runner:qa",
    "kind": "agent"
  },
  "bindings": {
    "artifacts": [
      {
        "role": "log",
        "sha256": "sha256:c6b70fe8aa251af5a6d47cc1156ede937ee965fe05c7470034bd5ecdfe75053b"
      }
    ],
    "content": [
      {
        "path": "works/ST-002/qa.md",
        "sha256": "sha256:ebe9f7649cc4b1b3a433f0782ad98b10b8f81d9d0e229ffcea52bc8413418019"
      }
    ],
    "source": {
      "commit": "a6b7f86520d40b1a89122c5df602e040535f47f4",
      "kind": "git_commit",
      "repository_id": "repo_01M1RWXYDW6Q0WT9J0NMA466BH"
    },
    "work": []
  },
  "id": "rcpt_01M1W1J7J79MHVAQKV66XP92N7",
  "kind": "qa_checkpoint",
  "payload": {
    "baseline_content_hash": "sha256:ebe9f7649cc4b1b3a433f0782ad98b10b8f81d9d0e229ffcea52bc8413418019",
    "cases": [
      {
        "case_hash": "sha256:72647249808b5840da461c6e9dbc75982f1935edee9692793852b360e23d63d9",
        "case_id": "QA-003",
        "outcome": "passed"
      },
      {
        "case_hash": "sha256:5331c877523e9cf72a8bb2e776624b6d78375b64195a72d08ba1d243b420e5fc",
        "case_id": "QA-004",
        "outcome": "passed"
      }
    ],
    "executor": {
      "capabilities": [
        "runner"
      ],
      "name": "pulse",
      "version": "0.1.0"
    },
    "findings": [],
    "observations": [
      "QA-003: createTodo stored due 2026-12-01 verbatim, the undated sibling has no due field and the input list was not mutated",
      "QA-004: createTodo threw TypeError for 12/01/2026 and 2026-02-30 without returning a todo"
    ],
    "payload_version": 1,
    "qa_scope": "story_close",
    "story_id": "ST-002",
    "ticket_id": "TK-005"
  },
  "receipt_version": 2,
  "recorded_at": "2026-09-06T19:01:47.207862Z",
  "result": "passed",
  "schema_version": 1,
  "subject": {
    "id": "ST-002",
    "kind": "work"
  }
}
